{
  "$schema": "https://json-schema.org/draft/2020-12/schema",
  "$id": "https://my-knowledge-os.local/schemas/v2/source-revision.schema.json",
  "title": "My Knowledge OS Source revision v2",
  "type": "object",
  "additionalProperties": false,
  "required": ["schema_version", "record_type", "record_id", "asset_id", "asset_fingerprint", "evidence_basis", "response"],
  "properties": {
    "schema_version": { "const": 2 },
    "record_type": { "const": "source" },
    "record_id": { "type": "string", "pattern": "^personal-source-[a-f0-9]{64}$" },
    "asset_id": { "type": "string", "pattern": "^personal-asset-[a-f0-9]{64}$" },
    "asset_fingerprint": { "$ref": "#/$defs/digest" },
    "evidence_basis": { "$ref": "#/$defs/evidence_basis" },
    "authored_by": { "enum": ["ai", "human"] },
    "response": { "$ref": "#/$defs/response" }
  },
  "$defs": {
    "digest": { "type": "string", "pattern": "^sha256:[a-f0-9]{64}$" },
    "string_array": {
      "type": "array",
      "maxItems": 1024,
      "items": { "type": "string", "maxLength": 4096 }
    },
    "evidence_basis": {
      "type": "object",
      "additionalProperties": false,
      "required": ["bundle_id", "content_digest", "asset_fingerprint", "extractor_name", "extractor_version"],
      "properties": {
        "bundle_id": { "type": "string", "pattern": "^prepared-content-sha256-[a-f0-9]{64}$" },
        "content_digest": { "$ref": "#/$defs/digest" },
        "asset_fingerprint": { "$ref": "#/$defs/digest" },
        "extractor_name": { "type": "string", "minLength": 1, "maxLength": 128 },
        "extractor_version": { "type": "string", "minLength": 1, "maxLength": 128 }
      }
    },
    "span": {
      "type": "object",
      "additionalProperties": false,
      "required": ["start", "end"],
      "properties": {
        "start": { "type": "integer", "minimum": 0 },
        "end": { "type": "integer", "minimum": 0 }
      }
    },
    "range": {
      "type": "object",
      "additionalProperties": false,
      "required": ["row_start", "row_end", "column_start", "column_end"],
      "properties": {
        "row_start": { "type": "integer", "minimum": 0 },
        "row_end": { "type": "integer", "minimum": 0 },
        "column_start": { "type": "integer", "minimum": 0 },
        "column_end": { "type": "integer", "minimum": 0 }
      }
    },
    "evidence_ref": {
      "type": "object",
      "additionalProperties": false,
      "required": ["block_id", "locator", "text_span_utf8", "table_range"],
      "properties": {
        "block_id": { "type": "string", "minLength": 1, "maxLength": 4096 },
        "locator": { "type": "string", "minLength": 1, "maxLength": 4096 },
        "text_span_utf8": { "anyOf": [{ "$ref": "#/$defs/span" }, { "type": "null" }] },
        "table_range": { "anyOf": [{ "$ref": "#/$defs/range" }, { "type": "null" }] }
      },
      "not": {
        "properties": {
          "text_span_utf8": { "type": "object" },
          "table_range": { "type": "object" }
        },
        "required": ["text_span_utf8", "table_range"]
      }
    },
    "response": {
      "type": "object",
      "additionalProperties": false,
      "required": ["schema_version", "title", "authors", "publication_date", "one_sentence_summary", "general_summary", "key_claims", "limitations", "tags", "knowledge_recommendation"],
      "properties": {
        "schema_version": { "const": 2 },
        "title": { "type": "string", "minLength": 1, "maxLength": 4096 },
        "authors": { "$ref": "#/$defs/string_array" },
        "publication_date": { "anyOf": [{ "type": "string", "format": "date" }, { "type": "null" }] },
        "one_sentence_summary": { "type": "string", "minLength": 1, "maxLength": 65536 },
        "general_summary": { "type": "string", "minLength": 1, "maxLength": 262144 },
        "key_claims": {
          "type": "array",
          "maxItems": 1024,
          "items": {
            "type": "object",
            "additionalProperties": false,
            "required": ["text", "evidence_refs"],
            "properties": {
              "text": { "type": "string", "minLength": 1, "maxLength": 65536 },
              "evidence_refs": { "type": "array", "minItems": 1, "maxItems": 1024, "items": { "$ref": "#/$defs/evidence_ref" } }
            }
          }
        },
        "limitations": {
          "type": "array",
          "maxItems": 1024,
          "items": {
            "type": "object",
            "additionalProperties": false,
            "required": ["text", "basis", "evidence_refs"],
            "properties": {
              "text": { "type": "string", "minLength": 1, "maxLength": 65536 },
              "basis": { "enum": ["stated", "observed_missing_evidence"] },
              "evidence_refs": { "type": "array", "maxItems": 1024, "items": { "$ref": "#/$defs/evidence_ref" } }
            },
            "if": { "properties": { "basis": { "const": "stated" } } },
            "then": { "properties": { "evidence_refs": { "minItems": 1 } } }
          }
        },
        "tags": { "$ref": "#/$defs/string_array" },
        "knowledge_recommendation": {
          "type": "object",
          "additionalProperties": false,
          "required": ["outcome", "reasons"],
          "properties": {
            "outcome": { "enum": ["recommend", "reference_only", "archive"] },
            "reasons": { "type": "array", "maxItems": 1024, "items": { "type": "string", "minLength": 1, "maxLength": 65536 } }
          }
        }
      }
    }
  }
}
